number,value,state,params_classification_loss,params_dropout,params_feature_normalization,params_hidden_dim,params_learning_rate,params_membership_topk,params_num_charts,params_seed,params_transportability_beta,params_weight_decay,user_attrs_dataset,user_attrs_last_intermediate_test,user_attrs_metric_name,user_attrs_resolved_params,user_attrs_run_dir,user_attrs_split_protocol,user_attrs_test_metric,user_attrs_validation_metric
0,0.11250000447034836,PRUNED,weighted_ce,0.1,none,64,0.00021708797465744292,2,3,470,1.0,0.004434664071892905,,0.11250000447034836,,,,,,
1,0.2585526406764984,PRUNED,cross_entropy,0.4,layernorm,128,0.0007296671764405778,1,2,463,1.0,0.00019855424222813234,,0.2585526406764984,,,,,,
2,,FAIL,weighted_ce,0.1,none,128,0.004949371718410307,1,3,232,2.0,0.0003539353163534052,,0.31315791606903076,,,,,,
3,0.2585526406764984,PRUNED,weighted_ce,0.1,none,64,0.00021708797465744292,2,3,470,1.0,0.004434664071892905,,0.2585526406764984,,,,,,
4,0.2585526406764984,PRUNED,cross_entropy,0.4,layernorm,128,0.0007296671764405778,1,2,463,1.0,0.00019855424222813234,,0.2585526406764984,,,,,,
5,0.3552631735801697,COMPLETE,weighted_ce,0.1,none,128,0.004949371718410307,1,3,232,2.0,0.0003539353163534052,actor,0.35328948497772217,accuracy,"{'learning_rate': 0.004949371718410307, 'weight_decay': 0.0003539353163534052, 'dropout': 0.1, 'hidden_dim': 128, 'num_charts': 3, 'membership_topk': 1, 'transportability_beta': 2.0, 'classification_loss': 'weighted_ce', 'feature_normalization': 'none', 'seed': 232}",outputs\oracle_upper_bound\runs\actor\trial_0005,stratified_60_20_20,0.3552631735801697,0.378947377204895
6,0.43223685026168823,COMPLETE,weighted_ce,0.0,layernorm,256,0.00012568359857395009,1,2,56,2.0,0.00025264755605853504,actor,0.4546052813529968,accuracy,"{'learning_rate': 0.00012568359857395009, 'weight_decay': 0.00025264755605853504, 'dropout': 0.0, 'hidden_dim': 256, 'num_charts': 2, 'membership_topk': 1, 'transportability_beta': 2.0, 'classification_loss': 'weighted_ce', 'feature_normalization': 'layernorm', 'seed': 56}",outputs\oracle_upper_bound\runs\actor\trial_0006,stratified_60_20_20,0.43223685026168823,0.43881580233573914
7,0.17565789818763733,PRUNED,focal,0.0,none,64,0.00013094977105316857,1,3,835,0.25,0.006125827675036417,,0.17565789818763733,,,,,,
8,0.1763157993555069,PRUNED,weighted_ce,0.2,layernorm,64,0.00019174605411663692,2,3,158,0.5,0.008479055305976748,,0.17565789818763733,,,,,,
9,0.2605263292789459,PRUNED,focal,0.2,layernorm,128,0.0002056022216343343,1,2,28,2.0,1.3249482338353262e-05,,0.25789475440979004,,,,,,
10,0.32697370648384094,COMPLETE,focal,0.0,layernorm,128,0.00298774165199261,2,3,66,0.5,0.0002533102831787697,actor,0.3368421196937561,accuracy,"{'learning_rate': 0.00298774165199261, 'weight_decay': 0.0002533102831787697, 'dropout': 0.0, 'hidden_dim': 128, 'num_charts': 3, 'membership_topk': 2, 'transportability_beta': 0.5, 'classification_loss': 'focal', 'feature_normalization': 'layernorm', 'seed': 66}",outputs\oracle_upper_bound\runs\actor\trial_0010,stratified_60_20_20,0.32697370648384094,0.3440789580345154
11,0.24605263769626617,PRUNED,weighted_ce,0.0,layernorm,256,0.00014267420535986642,1,1,31,2.0,5.6338536710564645e-05,,0.24934211373329163,,,,,,
12,0.3835526406764984,COMPLETE,cross_entropy,0.0,none,64,0.004716982067408969,1,3,270,2.0,0.00020629096334142104,actor,0.36907896399497986,accuracy,"{'learning_rate': 0.004716982067408969, 'weight_decay': 0.00020629096334142104, 'dropout': 0.0, 'hidden_dim': 64, 'num_charts': 3, 'membership_topk': 1, 'transportability_beta': 2.0, 'classification_loss': 'cross_entropy', 'feature_normalization': 'none', 'seed': 270}",outputs\oracle_upper_bound\runs\actor\trial_0012,stratified_60_20_20,0.3835526406764984,0.401973694562912
13,0.3190789520740509,PRUNED,weighted_ce,0.0,none,256,0.0002158021523936879,1,2,197,4.0,0.0019655415486589073,,0.3210526406764984,,,,,,
14,0.2585526406764984,PRUNED,cross_entropy,0.0,none,64,0.0023881302200985726,1,4,244,1.0,0.00030764179451306807,,0.2585526406764984,,,,,,
15,0.2585526406764984,PRUNED,cross_entropy,0.0,none,64,0.0015321960994712927,1,1,883,2.0,5.076074233467196e-05,,0.2585526406764984,,,,,,
16,0.27302631735801697,PRUNED,cross_entropy,0.0,layernorm,256,0.000116330939353381,2,2,21,0.25,0.0002629324288744431,,0.2723684310913086,,,,,,
17,0.214473694562912,PRUNED,weighted_ce,0.0,layernorm,64,0.0002695759004785301,1,2,559,2.0,6.34782145898251e-05,,0.214473694562912,,,,,,
18,0.2585526406764984,PRUNED,cross_entropy,0.0,l2,64,0.004443468335903943,1,3,546,2.0,0.00031297108216076793,,0.2585526406764984,,,,,,
19,0.2388157993555069,PRUNED,cross_entropy,0.0,none,64,0.00011150970716124206,1,2,62,2.0,9.382473654354117e-05,,0.2388157993555069,,,,,,
20,0.3526315987110138,COMPLETE,focal,0.0,none,64,0.004528163244746618,2,3,606,2.0,1.1864931436422425e-05,actor,0.35592105984687805,accuracy,"{'learning_rate': 0.004528163244746618, 'weight_decay': 1.1864931436422425e-05, 'dropout': 0.0, 'hidden_dim': 64, 'num_charts': 3, 'membership_topk': 2, 'transportability_beta': 2.0, 'classification_loss': 'focal', 'feature_normalization': 'none', 'seed': 606}",outputs\oracle_upper_bound\runs\actor\trial_0020,stratified_60_20_20,0.3526315987110138,0.3657895028591156
21,0.11184211075305939,PRUNED,weighted_ce,0.1,layernorm,256,0.00017276848401785537,1,3,321,2.0,0.0017127132389169139,,0.11250000447034836,,,,,,
22,0.17565789818763733,PRUNED,weighted_ce,0.2,none,128,0.0037383607542488917,1,3,398,0.25,0.0019488739233966814,,0.17565789818763733,,,,,,
23,0.3480263352394104,PRUNED,weighted_ce,0.1,none,128,0.001191427151112732,1,3,205,2.0,0.00035681856668918333,,0.38684213161468506,,,,,,
24,0.43815791606903076,COMPLETE,cross_entropy,0.0,none,256,0.002842135551479844,2,3,148,2.0,6.331184023031229e-05,actor,0.40526318550109863,accuracy,"{'learning_rate': 0.002842135551479844, 'weight_decay': 6.331184023031229e-05, 'dropout': 0.0, 'hidden_dim': 256, 'num_charts': 3, 'membership_topk': 2, 'transportability_beta': 2.0, 'classification_loss': 'cross_entropy', 'feature_normalization': 'none', 'seed': 148}",outputs\oracle_upper_bound\runs\actor\trial_0024,stratified_60_20_20,0.43815791606903076,0.432894766330719
25,0.37763160467147827,PRUNED,cross_entropy,0.0,none,256,0.002104289297695767,1,3,16,0.0,2.1159936401602473e-05,,0.36710527539253235,,,,,,
26,0.38092106580734253,COMPLETE,cross_entropy,0.0,l2,256,0.002743682671913969,2,1,38,2.0,0.00036714702068406727,actor,0.3835526406764984,accuracy,"{'learning_rate': 0.002743682671913969, 'weight_decay': 0.00036714702068406727, 'dropout': 0.0, 'hidden_dim': 256, 'num_charts': 1, 'membership_topk': 1, 'transportability_beta': 2.0, 'classification_loss': 'cross_entropy', 'feature_normalization': 'l2', 'seed': 38}",outputs\oracle_upper_bound\runs\actor\trial_0026,stratified_60_20_20,0.38092106580734253,0.39144739508628845
27,0.41842105984687805,COMPLETE,cross_entropy,0.0,none,256,0.002414817882953579,2,3,449,1.0,0.00017674102316776397,actor,0.35592105984687805,accuracy,"{'learning_rate': 0.002414817882953579, 'weight_decay': 0.00017674102316776397, 'dropout': 0.0, 'hidden_dim': 256, 'num_charts': 3, 'membership_topk': 2, 'transportability_beta': 1.0, 'classification_loss': 'cross_entropy', 'feature_normalization': 'none', 'seed': 449}",outputs\oracle_upper_bound\runs\actor\trial_0027,stratified_60_20_20,0.41842105984687805,0.4065789580345154
28,0.401973694562912,COMPLETE,cross_entropy,0.0,none,256,0.0013044852817884866,2,3,781,1.0,0.0011631917990618712,actor,0.38486844301223755,accuracy,"{'learning_rate': 0.0013044852817884866, 'weight_decay': 0.0011631917990618712, 'dropout': 0.0, 'hidden_dim': 256, 'num_charts': 3, 'membership_topk': 2, 'transportability_beta': 1.0, 'classification_loss': 'cross_entropy', 'feature_normalization': 'none', 'seed': 781}",outputs\oracle_upper_bound\runs\actor\trial_0028,stratified_60_20_20,0.401973694562912,0.40526318550109863
29,0.37171053886413574,COMPLETE,weighted_ce,0.0,none,256,0.0014781734946679402,2,2,349,0.5,4.493203931181727e-05,actor,0.36250001192092896,accuracy,"{'learning_rate': 0.0014781734946679402, 'weight_decay': 4.493203931181727e-05, 'dropout': 0.0, 'hidden_dim': 256, 'num_charts': 2, 'membership_topk': 2, 'transportability_beta': 0.5, 'classification_loss': 'weighted_ce', 'feature_normalization': 'none', 'seed': 349}",outputs\oracle_upper_bound\runs\actor\trial_0029,stratified_60_20_20,0.37171053886413574,0.37368422746658325
30,0.37763160467147827,PRUNED,cross_entropy,0.2,none,256,0.0032358894531968447,2,3,18,1.0,0.0010522532583089224,,0.40460526943206787,,,,,,
31,0.36973685026168823,PRUNED,weighted_ce,0.4,none,256,0.003878035926915321,2,1,82,2.0,2.475980179956692e-05,,0.35986843705177307,,,,,,
32,0.3907894790172577,COMPLETE,cross_entropy,0.0,none,256,0.001583381929415606,2,3,776,0.5,0.0005979666997394388,actor,0.35855263471603394,accuracy,"{'learning_rate': 0.001583381929415606, 'weight_decay': 0.0005979666997394388, 'dropout': 0.0, 'hidden_dim': 256, 'num_charts': 3, 'membership_topk': 2, 'transportability_beta': 0.5, 'classification_loss': 'cross_entropy', 'feature_normalization': 'none', 'seed': 776}",outputs\oracle_upper_bound\runs\actor\trial_0032,stratified_60_20_20,0.3907894790172577,0.37763160467147827
33,0.2565789520740509,PRUNED,cross_entropy,0.0,none,256,0.004659966968565471,2,3,152,2.0,0.00010838706209813142,,0.2611842155456543,,,,,,
34,0.2585526406764984,PRUNED,cross_entropy,0.0,none,128,0.0023323022472070704,2,3,436,1.0,3.8317729021368744e-05,,0.2585526406764984,,,,,,
35,0.35394737124443054,COMPLETE,cross_entropy,0.0,layernorm,256,0.003534756696419642,2,2,647,1.0,0.003029821087764855,actor,0.3500000238418579,accuracy,"{'learning_rate': 0.003534756696419642, 'weight_decay': 0.003029821087764855, 'dropout': 0.0, 'hidden_dim': 256, 'num_charts': 2, 'membership_topk': 2, 'transportability_beta': 1.0, 'classification_loss': 'cross_entropy', 'feature_normalization': 'layernorm', 'seed': 647}",outputs\oracle_upper_bound\runs\actor\trial_0035,stratified_60_20_20,0.35394737124443054,0.378947377204895
36,0.31973686814308167,COMPLETE,weighted_ce,0.0,layernorm,256,0.0001283872763647947,1,2,310,1.0,0.0006951073199335466,actor,0.31381580233573914,accuracy,"{'learning_rate': 0.0001283872763647947, 'weight_decay': 0.0006951073199335466, 'dropout': 0.0, 'hidden_dim': 256, 'num_charts': 2, 'membership_topk': 1, 'transportability_beta': 1.0, 'classification_loss': 'weighted_ce', 'feature_normalization': 'layernorm', 'seed': 310}",outputs\oracle_upper_bound\runs\actor\trial_0036,stratified_60_20_20,0.31973686814308167,0.3453947603702545
37,0.2585526406764984,PRUNED,cross_entropy,0.1,none,128,0.0012139920826376338,2,3,877,1.0,0.003036453593750174,,0.2585526406764984,,,,,,
38,0.38026317954063416,PRUNED,cross_entropy,0.0,l2,256,0.00488905219279482,2,3,388,1.0,0.00033240587972039004,,0.36052632331848145,,,,,,
39,0.3546052873134613,COMPLETE,focal,0.6,none,256,0.0010218683396235957,2,3,854,1.0,0.00021376806400687072,actor,0.366447389125824,accuracy,"{'learning_rate': 0.0010218683396235957, 'weight_decay': 0.00021376806400687072, 'dropout': 0.6, 'hidden_dim': 256, 'num_charts': 3, 'membership_topk': 2, 'transportability_beta': 1.0, 'classification_loss': 'focal', 'feature_normalization': 'none', 'seed': 854}",outputs\oracle_upper_bound\runs\actor\trial_0039,stratified_60_20_20,0.3546052873134613,0.38881582021713257
40,0.41184213757514954,COMPLETE,weighted_ce,0.2,none,256,0.0015531287410778872,2,3,520,4.0,0.0006140230922073943,actor,0.40526318550109863,accuracy,"{'learning_rate': 0.0015531287410778872, 'weight_decay': 0.0006140230922073943, 'dropout': 0.2, 'hidden_dim': 256, 'num_charts': 3, 'membership_topk': 2, 'transportability_beta': 4.0, 'classification_loss': 'weighted_ce', 'feature_normalization': 'none', 'seed': 520}",outputs\oracle_upper_bound\runs\actor\trial_0040,stratified_60_20_20,0.41184213757514954,0.4151315987110138
