number,value,state,params_classification_loss,params_dropout,params_feature_normalization,params_hidden_dim,params_learning_rate,params_membership_topk,params_num_charts,params_seed,params_transportability_beta,params_weight_decay,user_attrs_dataset,user_attrs_last_intermediate_test,user_attrs_metric_name,user_attrs_resolved_params,user_attrs_run_dir,user_attrs_split_protocol,user_attrs_test_metric,user_attrs_validation_metric
0,0.6783546231902031,PRUNED,weighted_ce,0.1,none,64,0.00021708797465744292,2,3,470,1.0,0.004434664071892905,,0.6767201218562083,,,,,,
1,0.5455418499120739,PRUNED,cross_entropy,0.4,layernorm,128,0.0007296671764405778,1,2,463,1.0,0.00019855424222813234,,0.5617856344080551,,,,,,
2,0.798266283799039,COMPLETE,weighted_ce,0.1,none,128,0.004949371718410307,1,3,232,2.0,0.0003539353163534052,tolokers,0.7666224651714477,roc_auc,"{'learning_rate': 0.004949371718410307, 'weight_decay': 0.0003539353163534052, 'dropout': 0.1, 'hidden_dim': 128, 'num_charts': 3, 'membership_topk': 1, 'transportability_beta': 2.0, 'classification_loss': 'weighted_ce', 'feature_normalization': 'none', 'seed': 232}",outputs\oracle_upper_bound\runs\tolokers\trial_0002,stratified_60_20_20,0.798266283799039,0.79172615848727
3,0.6918784787477728,PRUNED,weighted_ce,0.0,layernorm,256,0.00012568359857395009,1,2,56,2.0,0.00025264755605853504,,0.708228792027195,,,,,,
4,0.6144818726170147,PRUNED,focal,0.0,none,64,0.00013094977105316857,1,3,835,0.25,0.006125827675036417,,0.6060973683680533,,,,,,
5,0.634670932057956,PRUNED,weighted_ce,0.2,layernorm,64,0.00019174605411663692,2,3,158,0.5,0.008479055305976748,,0.6583500016429813,,,,,,
6,0.6565623320581678,PRUNED,focal,0.2,layernorm,128,0.0002056022216343343,1,2,28,2.0,1.3249482338353262e-05,,0.6442866122468882,,,,,,
7,0.807034503665968,COMPLETE,focal,0.0,layernorm,128,0.00298774165199261,2,3,66,0.5,0.0002533102831787697,tolokers,0.7989234762939007,roc_auc,"{'learning_rate': 0.00298774165199261, 'weight_decay': 0.0002533102831787697, 'dropout': 0.0, 'hidden_dim': 128, 'num_charts': 3, 'membership_topk': 2, 'transportability_beta': 0.5, 'classification_loss': 'focal', 'feature_normalization': 'layernorm', 'seed': 66}",outputs\oracle_upper_bound\runs\tolokers\trial_0007,stratified_60_20_20,0.807034503665968,0.8282957408626394
8,0.6620313396021017,PRUNED,cross_entropy,0.2,layernorm,256,0.0007378823171365055,2,2,598,0.25,0.0005115321523759829,,0.6819145925353534,,,,,,
9,0.7084036900298598,PRUNED,weighted_ce,0.1,layernorm,128,0.000780364032001287,2,1,19,0.0,4.440767851247589e-05,,0.7146226390094625,,,,,,
10,0.7140772752375169,PRUNED,focal,0.0,layernorm,256,0.0007462467514856694,1,3,415,0.5,6.08272865994506e-05,,0.6811635911117895,,,,,,
11,0.7085923678751589,PRUNED,focal,0.0,layernorm,128,0.003671899515437492,2,3,80,1.0,0.0005215771448028945,,0.6855100714749838,,,,,,
12,0.808565126186259,COMPLETE,weighted_ce,0.1,none,128,0.0026160532960286787,1,2,295,4.0,0.002406165266691489,tolokers,0.8120715661427146,roc_auc,"{'learning_rate': 0.0026160532960286787, 'weight_decay': 0.002406165266691489, 'dropout': 0.1, 'hidden_dim': 128, 'num_charts': 2, 'membership_topk': 1, 'transportability_beta': 4.0, 'classification_loss': 'weighted_ce', 'feature_normalization': 'none', 'seed': 295}",outputs\oracle_upper_bound\runs\tolokers\trial_0012,stratified_60_20_20,0.808565126186259,0.8230170011458469
13,0.8006819962116032,COMPLETE,weighted_ce,0.1,none,128,0.0018078220708944465,1,2,601,4.0,0.007329435916231475,tolokers,0.8006819962116032,roc_auc,"{'learning_rate': 0.0018078220708944465, 'weight_decay': 0.007329435916231475, 'dropout': 0.1, 'hidden_dim': 128, 'num_charts': 2, 'membership_topk': 1, 'transportability_beta': 4.0, 'classification_loss': 'weighted_ce', 'feature_normalization': 'none', 'seed': 601}",outputs\oracle_upper_bound\runs\tolokers\trial_0013,stratified_60_20_20,0.8006819962116032,0.7945176366085899
14,0.7291079035877409,PRUNED,weighted_ce,0.6,layernorm,128,0.001729377826477819,1,2,182,4.0,0.00034249845618597566,,0.7373270497250921,,,,,,
15,0.698189646674235,PRUNED,cross_entropy,0.4,layernorm,128,0.004028080339831145,2,1,247,0.5,4.7186293938142616e-05,,0.6988341193143575,,,,,,
16,0.7121899667905792,PRUNED,focal,0.2,l2,128,0.0027263564686912773,2,2,138,0.5,0.009841310005606294,,0.6935749893736213,,,,,,
17,0.780270339312725,PRUNED,weighted_ce,0.2,none,256,0.0012318672004760403,1,4,256,4.0,0.0010845911227170759,,0.7723728995014877,,,,,,
18,0.7039496208953294,PRUNED,cross_entropy,0.1,none,128,0.003516229812321159,1,2,344,4.0,5.357446314603906e-05,,0.7076171790118158,,,,,,
19,0.6719660761474104,PRUNED,focal,0.0,none,128,0.0012719307047909896,2,3,428,0.0,0.00039014515880432727,,0.6591015330604925,,,,,,
20,0.7797037757828805,PRUNED,focal,0.6,layernorm,256,0.002058307680342485,2,3,139,0.5,1.917584997155997e-06,,0.765073822856943,,,,,,
21,0.6942316518745356,PRUNED,weighted_ce,0.1,l2,128,0.0016288044915050758,1,2,659,4.0,0.004557856507728693,,0.704984169080789,,,,,,
22,0.7321834584649043,PRUNED,weighted_ce,0.0,none,128,0.0032828389278356405,1,2,371,4.0,0.007017059552326753,,0.7399966292384942,,,,,,
23,0.6978048710683724,PRUNED,weighted_ce,0.1,none,128,0.0006911880379221885,1,1,548,4.0,0.007856711740684655,,0.6929639063521894,,,,,,
24,0.6982845155908319,PRUNED,weighted_ce,0.1,l2,256,0.0021771041781954003,1,2,128,0.0,0.0019006049456764098,,0.6984217840232265,,,,,,
25,0.6885214970845033,PRUNED,focal,0.0,layernorm,64,0.0019651336936288236,2,4,99,0.5,9.165190484078092e-05,,0.6780811463133091,,,,,,
26,0.7822901462465299,COMPLETE,weighted_ce,0.1,none,256,0.0017835560844929868,1,2,849,1.0,0.004651548027644901,tolokers,0.7863509598720382,roc_auc,"{'learning_rate': 0.0017835560844929868, 'weight_decay': 0.004651548027644901, 'dropout': 0.1, 'hidden_dim': 256, 'num_charts': 2, 'membership_topk': 1, 'transportability_beta': 1.0, 'classification_loss': 'weighted_ce', 'feature_normalization': 'none', 'seed': 849}",outputs\oracle_upper_bound\runs\tolokers\trial_0026,stratified_60_20_20,0.7822901462465299,0.8035524434310959
27,0.7176186947945054,PRUNED,weighted_ce,0.0,layernorm,128,0.003040008373266238,2,3,426,0.5,0.004157859011783808,,0.7439169944679231,,,,,,
28,0.7055597425077405,PRUNED,focal,0.0,layernorm,128,0.004799728502183199,1,1,68,2.0,6.772209926358603e-05,,0.7107812428782063,,,,,,
29,0.6695641435774804,PRUNED,cross_entropy,0.4,none,128,0.0016293128983174683,1,1,170,0.5,0.004671867091136416,,0.6919611578035779,,,,,,
30,0.6844490235921505,PRUNED,focal,0.1,none,64,0.003685877679754094,1,2,277,0.5,0.0018106426707919633,,0.6838050809459756,,,,,,
31,0.7058920487128036,PRUNED,weighted_ce,0.1,none,128,0.004123270242589324,1,3,356,2.0,0.003936971565799051,,0.6977566416191527,,,,,,
32,0.7234645280350899,PRUNED,weighted_ce,0.1,none,128,0.0013093975816358691,1,3,217,0.25,3.11421228832322e-05,,0.7375660769954007,,,,,,
33,0.7658926635057828,PRUNED,focal,0.1,layernorm,128,0.0033645431197423365,1,3,70,0.5,0.00027418033791142286,,0.7795797571991727,,,,,,
34,0.6357219100557872,PRUNED,cross_entropy,0.1,none,128,0.0014830037245253417,1,2,571,4.0,0.00955292708620178,,0.6582927622966546,,,,,,
35,0.7304933077664254,PRUNED,weighted_ce,0.0,l2,256,0.004983439184047493,2,3,29,0.5,0.0002105104547761968,,0.7361584130709227,,,,,,
36,0.7944439674498917,PRUNED,weighted_ce,0.1,none,256,0.004453597934568752,2,2,36,4.0,0.001224405583322105,,0.799313551839238,,,,,,
37,0.7371389018737406,PRUNED,weighted_ce,0.1,none,128,0.0017259802758581284,1,2,271,1.0,0.000989131545509567,,0.7312617989902556,,,,,,
38,0.6903595160943261,PRUNED,cross_entropy,0.1,l2,128,0.0024981027026128376,2,3,189,0.5,0.0001965448801717392,,0.6815170970747514,,,,,,
39,0.7199914776973246,PRUNED,weighted_ce,0.2,none,128,0.004224711320840457,1,3,118,2.0,0.0001624680889701746,,0.7199882977336399,,,,,,
