number,value,state,params_classification_loss,params_dropout,params_feature_normalization,params_hidden_dim,params_learning_rate,params_membership_topk,params_num_charts,params_seed,params_transportability_beta,params_weight_decay,user_attrs_dataset,user_attrs_last_intermediate_test,user_attrs_metric_name,user_attrs_resolved_params,user_attrs_run_dir,user_attrs_split_protocol,user_attrs_test_metric,user_attrs_validation_metric
0,0.222222238779068,PRUNED,weighted_ce,0.1,none,64,0.00021708797465744292,2,3,470,1.0,0.004434664071892905,,0.20512820780277252,,,,,,
1,0.692307710647583,COMPLETE,cross_entropy,0.4,layernorm,128,0.0007296671764405778,1,2,463,1.0,0.00019855424222813234,hetgb_cornell,0.692307710647583,accuracy,"{'learning_rate': 0.0007296671764405778, 'weight_decay': 0.00019855424222813234, 'dropout': 0.4, 'hidden_dim': 128, 'num_charts': 2, 'membership_topk': 1, 'transportability_beta': 1.0, 'classification_loss': 'cross_entropy', 'feature_normalization': 'layernorm', 'seed': 463}",outputs\oracle_upper_bound\runs\hetgb_cornell\trial_0001,stratified_48_32_20,0.692307710647583,0.7301587462425232
2,0.523809552192688,PRUNED,weighted_ce,0.1,none,128,0.004949371718410307,1,3,232,2.0,0.0003539353163534052,,0.43589743971824646,,,,,,
3,0.4871794879436493,COMPLETE,weighted_ce,0.0,layernorm,256,0.00012568359857395009,1,2,56,2.0,0.00025264755605853504,hetgb_cornell,0.43589743971824646,accuracy,"{'learning_rate': 0.00012568359857395009, 'weight_decay': 0.00025264755605853504, 'dropout': 0.0, 'hidden_dim': 256, 'num_charts': 2, 'membership_topk': 1, 'transportability_beta': 2.0, 'classification_loss': 'weighted_ce', 'feature_normalization': 'layernorm', 'seed': 56}",outputs\oracle_upper_bound\runs\hetgb_cornell\trial_0003,stratified_48_32_20,0.4871794879436493,0.7777778506278992
4,0.0952381044626236,PRUNED,focal,0.0,none,64,0.00013094977105316857,1,3,835,0.25,0.006125827675036417,,0.10256410390138626,,,,,,
5,0.222222238779068,PRUNED,weighted_ce,0.2,layernorm,64,0.00019174605411663692,2,3,158,0.5,0.008479055305976748,,0.20512820780277252,,,,,,
6,0.0952381044626236,PRUNED,focal,0.2,layernorm,128,0.0002056022216343343,1,2,28,2.0,1.3249482338353262e-05,,0.10256410390138626,,,,,,
7,0.6666666865348816,COMPLETE,focal,0.0,layernorm,128,0.00298774165199261,2,3,66,0.5,0.0002533102831787697,hetgb_cornell,0.6666666865348816,accuracy,"{'learning_rate': 0.00298774165199261, 'weight_decay': 0.0002533102831787697, 'dropout': 0.0, 'hidden_dim': 128, 'num_charts': 3, 'membership_topk': 2, 'transportability_beta': 0.5, 'classification_loss': 'focal', 'feature_normalization': 'layernorm', 'seed': 66}",outputs\oracle_upper_bound\runs\hetgb_cornell\trial_0007,stratified_48_32_20,0.6666666865348816,0.8253968954086304
8,0.692307710647583,COMPLETE,cross_entropy,0.2,layernorm,256,0.0007378823171365055,2,2,598,0.25,0.0005115321523759829,hetgb_cornell,0.6153846383094788,accuracy,"{'learning_rate': 0.0007378823171365055, 'weight_decay': 0.0005115321523759829, 'dropout': 0.2, 'hidden_dim': 256, 'num_charts': 2, 'membership_topk': 2, 'transportability_beta': 0.25, 'classification_loss': 'cross_entropy', 'feature_normalization': 'layernorm', 'seed': 598}",outputs\oracle_upper_bound\runs\hetgb_cornell\trial_0008,stratified_48_32_20,0.692307710647583,0.7936508655548096
9,0.6666666865348816,COMPLETE,weighted_ce,0.1,layernorm,128,0.000780364032001287,2,1,19,0.0,4.440767851247589e-05,hetgb_cornell,0.6153846383094788,accuracy,"{'learning_rate': 0.000780364032001287, 'weight_decay': 4.440767851247589e-05, 'dropout': 0.1, 'hidden_dim': 128, 'num_charts': 1, 'membership_topk': 1, 'transportability_beta': 0.0, 'classification_loss': 'weighted_ce', 'feature_normalization': 'layernorm', 'seed': 19}",outputs\oracle_upper_bound\runs\hetgb_cornell\trial_0009,stratified_48_32_20,0.6666666865348816,0.8253968954086304
10,0.444444477558136,PRUNED,cross_entropy,0.4,layernorm,128,0.0002740678583228382,1,3,652,0.25,1.6552524275142678e-05,,0.43589743971824646,,,,,,
11,0.6190476417541504,PRUNED,focal,0.2,layernorm,256,0.0024977875923523195,2,2,711,0.25,0.0005915927172046711,,0.38461539149284363,,,,,,
12,0.8974359035491943,COMPLETE,cross_entropy,0.2,layernorm,256,0.0007846218138357549,2,2,353,1.0,0.00013599430914566123,hetgb_cornell,0.8461538553237915,accuracy,"{'learning_rate': 0.0007846218138357549, 'weight_decay': 0.00013599430914566123, 'dropout': 0.2, 'hidden_dim': 256, 'num_charts': 2, 'membership_topk': 2, 'transportability_beta': 1.0, 'classification_loss': 'cross_entropy', 'feature_normalization': 'layernorm', 'seed': 353}",outputs\oracle_upper_bound\runs\hetgb_cornell\trial_0012,stratified_48_32_20,0.8974359035491943,0.9047619700431824
13,0.682539701461792,PRUNED,cross_entropy,0.2,layernorm,256,0.001402066181729982,2,3,98,1.0,7.4164121061829e-05,,0.7435897588729858,,,,,,
14,0.8205128312110901,COMPLETE,cross_entropy,0.4,layernorm,128,0.00177994047547668,1,2,437,1.0,4.2175457522372115e-05,hetgb_cornell,0.7692307829856873,accuracy,"{'learning_rate': 0.00177994047547668, 'weight_decay': 4.2175457522372115e-05, 'dropout': 0.4, 'hidden_dim': 128, 'num_charts': 2, 'membership_topk': 1, 'transportability_beta': 1.0, 'classification_loss': 'cross_entropy', 'feature_normalization': 'layernorm', 'seed': 437}",outputs\oracle_upper_bound\runs\hetgb_cornell\trial_0014,stratified_48_32_20,0.8205128312110901,0.8412699103355408
15,0.222222238779068,PRUNED,cross_entropy,0.2,none,256,0.00017835904837951,2,4,448,1.0,0.00015019776146113246,,0.20512820780277252,,,,,,
16,0.4285714626312256,PRUNED,cross_entropy,0.4,l2,128,0.002597863262797559,2,2,282,0.25,9.094050716132796e-06,,0.43589743971824646,,,,,,
17,0.3492063581943512,PRUNED,weighted_ce,0.4,layernorm,128,0.004959266769230867,1,2,806,1.0,0.0005868587254899155,,0.3589743673801422,,,,,,
18,0.4285714626312256,PRUNED,cross_entropy,0.4,none,128,0.003048727742192918,1,2,459,1.0,2.6529058507967817e-06,,0.43589743971824646,,,,,,
19,0.6666666865348816,COMPLETE,cross_entropy,0.0,layernorm,128,0.0036472573029775537,1,4,804,2.0,4.63543829054519e-05,hetgb_cornell,0.6666666865348816,accuracy,"{'learning_rate': 0.0036472573029775537, 'weight_decay': 4.63543829054519e-05, 'dropout': 0.0, 'hidden_dim': 128, 'num_charts': 4, 'membership_topk': 1, 'transportability_beta': 2.0, 'classification_loss': 'cross_entropy', 'feature_normalization': 'layernorm', 'seed': 804}",outputs\oracle_upper_bound\runs\hetgb_cornell\trial_0019,stratified_48_32_20,0.6666666865348816,0.7460317611694336
20,0.4285714626312256,PRUNED,cross_entropy,0.6,layernorm,128,0.0010790393105182677,1,2,437,0.0,4.215976049235723e-06,,0.43589743971824646,,,,,,
21,0.6507936716079712,PRUNED,cross_entropy,0.4,layernorm,128,0.0016089799514879392,1,2,504,1.0,0.00011541870573459259,,0.6153846383094788,,,,,,
22,0.6153846383094788,COMPLETE,weighted_ce,0.0,layernorm,256,0.0013825274939725594,2,2,423,1.0,0.0016664544047604115,hetgb_cornell,0.5641025900840759,accuracy,"{'learning_rate': 0.0013825274939725594, 'weight_decay': 0.0016664544047604115, 'dropout': 0.0, 'hidden_dim': 256, 'num_charts': 2, 'membership_topk': 2, 'transportability_beta': 1.0, 'classification_loss': 'weighted_ce', 'feature_normalization': 'layernorm', 'seed': 423}",outputs\oracle_upper_bound\runs\hetgb_cornell\trial_0022,stratified_48_32_20,0.6153846383094788,0.7460317611694336
23,0.4285714626312256,PRUNED,cross_entropy,0.4,layernorm,128,0.00025184443499836717,1,2,173,0.25,0.00666555122471161,,0.43589743971824646,,,,,,
24,0.4285714626312256,PRUNED,cross_entropy,0.2,l2,256,0.0005242582212074416,1,2,578,1.0,0.000529515690913707,,0.43589743971824646,,,,,,
25,0.1587301641702652,PRUNED,focal,0.4,layernorm,64,0.0005303020625317983,1,1,694,1.0,0.00010907567390321745,,0.28205129504203796,,,,,,
26,0.6507936716079712,PRUNED,cross_entropy,0.4,layernorm,256,0.002429341926801183,1,1,324,4.0,2.208437557262611e-05,,0.7435897588729858,,,,,,
27,0.4285714626312256,PRUNED,cross_entropy,0.4,none,64,0.0015175479328666806,2,2,244,1.0,0.00031974951848885415,,0.43589743971824646,,,,,,
28,0.4285714626312256,PRUNED,cross_entropy,0.4,layernorm,128,0.0001635492115343234,2,2,326,1.0,9.333689419022423e-05,,0.43589743971824646,,,,,,
29,0.4285714626312256,PRUNED,weighted_ce,0.2,l2,256,0.0002820230567028652,2,2,55,1.0,0.0001497592019817876,,0.43589743971824646,,,,,,
30,0.4285714626312256,PRUNED,cross_entropy,0.4,l2,128,0.0007432314211720314,1,1,603,1.0,0.0005652225130990665,,0.43589743971824646,,,,,,
31,0.4285714626312256,PRUNED,cross_entropy,0.0,none,256,0.0005320559929205811,2,2,619,0.25,0.0015975401518635074,,0.43589743971824646,,,,,,
32,0.5384615659713745,COMPLETE,cross_entropy,0.2,layernorm,256,0.0004620649485009182,2,1,749,0.25,0.0006579095854439257,hetgb_cornell,0.4615384638309479,accuracy,"{'learning_rate': 0.0004620649485009182, 'weight_decay': 0.0006579095854439257, 'dropout': 0.2, 'hidden_dim': 256, 'num_charts': 1, 'membership_topk': 1, 'transportability_beta': 0.25, 'classification_loss': 'cross_entropy', 'feature_normalization': 'layernorm', 'seed': 749}",outputs\oracle_upper_bound\runs\hetgb_cornell\trial_0032,stratified_48_32_20,0.5384615659713745,0.5873016119003296
33,0.4285714626312256,PRUNED,cross_entropy,0.0,layernorm,256,0.0003285471809839911,2,2,190,0.5,0.00014178178087157525,,0.43589743971824646,,,,,,
34,0.4285714626312256,PRUNED,cross_entropy,0.4,layernorm,128,0.0009367779536349639,2,4,588,0.0,0.0001030892956233357,,0.43589743971824646,,,,,,
35,0.6190476417541504,PRUNED,cross_entropy,0.1,layernorm,256,0.0012612246250049658,2,2,690,4.0,0.00010472959116876237,,0.6410256624221802,,,,,,
36,0.7179487347602844,COMPLETE,cross_entropy,0.6,layernorm,256,0.0006226104955340915,2,2,498,0.25,9.334286493682481e-05,hetgb_cornell,0.7435897588729858,accuracy,"{'learning_rate': 0.0006226104955340915, 'weight_decay': 9.334286493682481e-05, 'dropout': 0.6, 'hidden_dim': 256, 'num_charts': 2, 'membership_topk': 2, 'transportability_beta': 0.25, 'classification_loss': 'cross_entropy', 'feature_normalization': 'layernorm', 'seed': 498}",outputs\oracle_upper_bound\runs\hetgb_cornell\trial_0036,stratified_48_32_20,0.7179487347602844,0.7619048357009888
37,0.4761905074119568,PRUNED,weighted_ce,0.6,layernorm,128,0.0007129393563855032,1,3,371,1.0,0.0004023416538580617,,0.4615384638309479,,,,,,
38,0.30158731341362,PRUNED,focal,0.6,layernorm,256,0.0004999970086049982,2,2,614,0.25,1.9525443037399007e-05,,0.3076923191547394,,,,,,
39,0.6410256624221802,COMPLETE,cross_entropy,0.2,layernorm,256,0.0014420144346338785,2,2,381,1.0,8.227891178352455e-06,hetgb_cornell,0.692307710647583,accuracy,"{'learning_rate': 0.0014420144346338785, 'weight_decay': 8.227891178352455e-06, 'dropout': 0.2, 'hidden_dim': 256, 'num_charts': 2, 'membership_topk': 2, 'transportability_beta': 1.0, 'classification_loss': 'cross_entropy', 'feature_normalization': 'layernorm', 'seed': 381}",outputs\oracle_upper_bound\runs\hetgb_cornell\trial_0039,stratified_48_32_20,0.6410256624221802,0.6666666865348816
