number,value,state,params_classification_loss,params_dropout,params_feature_normalization,params_hidden_dim,params_learning_rate,params_membership_topk,params_num_charts,params_seed,params_transportability_beta,params_weight_decay,user_attrs_dataset,user_attrs_last_intermediate_test,user_attrs_metric_name,user_attrs_resolved_params,user_attrs_run_dir,user_attrs_split_protocol,user_attrs_test_metric,user_attrs_validation_metric
0,0.48924121260643005,PRUNED,weighted_ce,0.1,none,64,0.00021708797465744292,2,3,470,1.0,0.004434664071892905,,0.48868781328201294,,,,,,
1,0.48924121260643005,PRUNED,cross_entropy,0.4,layernorm,128,0.0007296671764405778,1,2,463,1.0,0.00019855424222813234,,0.48868781328201294,,,,,,
2,0.2748868763446808,COMPLETE,weighted_ce,0.1,none,128,0.004949371718410307,1,3,232,2.0,0.0003539353163534052,hetgb_actor,0.1764705926179886,accuracy,"{'learning_rate': 0.004949371718410307, 'weight_decay': 0.0003539353163534052, 'dropout': 0.1, 'hidden_dim': 128, 'num_charts': 3, 'membership_topk': 1, 'transportability_beta': 2.0, 'classification_loss': 'weighted_ce', 'feature_normalization': 'none', 'seed': 232}",outputs\oracle_upper_bound\runs\hetgb_actor\trial_0002,stratified_60_20_20,0.2748868763446808,0.2763306796550751
3,0.48868781328201294,COMPLETE,weighted_ce,0.0,layernorm,256,0.00012568359857395009,1,2,56,2.0,0.00025264755605853504,hetgb_actor,0.35972851514816284,accuracy,"{'learning_rate': 0.00012568359857395009, 'weight_decay': 0.00025264755605853504, 'dropout': 0.0, 'hidden_dim': 256, 'num_charts': 2, 'membership_topk': 1, 'transportability_beta': 2.0, 'classification_loss': 'weighted_ce', 'feature_normalization': 'layernorm', 'seed': 56}",outputs\oracle_upper_bound\runs\hetgb_actor\trial_0003,stratified_60_20_20,0.48868781328201294,0.48924121260643005
4,0.2276330590248108,PRUNED,focal,0.0,none,64,0.00013094977105316857,1,3,835,0.25,0.006125827675036417,,0.2273755818605423,,,,,,
5,0.48924121260643005,PRUNED,weighted_ce,0.2,layernorm,64,0.00019174605411663692,2,3,158,0.5,0.008479055305976748,,0.48868781328201294,,,,,,
6,0.23303169012069702,COMPLETE,focal,0.2,layernorm,128,0.0002056022216343343,1,2,28,2.0,1.3249482338353262e-05,hetgb_actor,0.12556561827659607,accuracy,"{'learning_rate': 0.0002056022216343343, 'weight_decay': 1.3249482338353262e-05, 'dropout': 0.2, 'hidden_dim': 128, 'num_charts': 2, 'membership_topk': 1, 'transportability_beta': 2.0, 'classification_loss': 'focal', 'feature_normalization': 'layernorm', 'seed': 28}",outputs\oracle_upper_bound\runs\hetgb_actor\trial_0006,stratified_60_20_20,0.23303169012069702,0.2434881031513214
7,0.6504524946212769,COMPLETE,focal,0.0,layernorm,128,0.00298774165199261,2,3,66,0.5,0.0002533102831787697,hetgb_actor,0.49434390664100647,accuracy,"{'learning_rate': 0.00298774165199261, 'weight_decay': 0.0002533102831787697, 'dropout': 0.0, 'hidden_dim': 128, 'num_charts': 3, 'membership_topk': 2, 'transportability_beta': 0.5, 'classification_loss': 'focal', 'feature_normalization': 'layernorm', 'seed': 66}",outputs\oracle_upper_bound\runs\hetgb_actor\trial_0007,stratified_60_20_20,0.6504524946212769,0.6228765249252319
8,0.48924121260643005,PRUNED,cross_entropy,0.2,layernorm,256,0.0007378823171365055,2,2,598,0.25,0.0005115321523759829,,0.48868781328201294,,,,,,
9,0.7352941632270813,COMPLETE,weighted_ce,0.1,layernorm,128,0.000780364032001287,2,1,19,0.0,4.440767851247589e-05,hetgb_actor,0.716063380241394,accuracy,"{'learning_rate': 0.000780364032001287, 'weight_decay': 4.440767851247589e-05, 'dropout': 0.1, 'hidden_dim': 128, 'num_charts': 1, 'membership_topk': 1, 'transportability_beta': 0.0, 'classification_loss': 'weighted_ce', 'feature_normalization': 'layernorm', 'seed': 19}",outputs\oracle_upper_bound\runs\hetgb_actor\trial_0009,stratified_60_20_20,0.7352941632270813,0.7734994292259216
10,0.21630804240703583,PRUNED,weighted_ce,0.2,layernorm,128,0.00028506408109193603,2,3,377,0.0,7.04309133252726e-06,,0.21606335043907166,,,,,,
11,0.48924121260643005,PRUNED,weighted_ce,0.1,none,128,0.0007716438848574661,2,1,43,0.0,0.000970322758165817,,0.48868781328201294,,,,,,
12,0.5542986392974854,COMPLETE,focal,0.0,layernorm,128,0.0016425772175830237,1,3,281,0.5,1.621105943052443e-05,hetgb_actor,0.5509049892425537,accuracy,"{'learning_rate': 0.0016425772175830237, 'weight_decay': 1.621105943052443e-05, 'dropout': 0.0, 'hidden_dim': 128, 'num_charts': 3, 'membership_topk': 1, 'transportability_beta': 0.5, 'classification_loss': 'focal', 'feature_normalization': 'layernorm', 'seed': 281}",outputs\oracle_upper_bound\runs\hetgb_actor\trial_0012,stratified_60_20_20,0.5542986392974854,0.5662513971328735
13,0.13137032091617584,PRUNED,focal,0.0,l2,128,0.0033542069483393847,2,4,49,0.5,0.0006668988071190579,,0.14819005131721497,,,,,,
14,0.2650056481361389,PRUNED,weighted_ce,0.1,layernorm,128,0.0006682916046447637,2,4,12,1.0,5.479146132714516e-06,,0.3009049892425537,,,,,,
15,0.48924121260643005,PRUNED,cross_entropy,0.0,layernorm,128,0.0007171459920277321,2,3,22,0.25,0.0002635014114501347,,0.48868781328201294,,,,,,
16,0.1778029352426529,PRUNED,focal,0.4,layernorm,128,0.002314775418431518,2,3,317,4.0,0.005006116991526176,,0.19570136070251465,,,,,,
17,0.7409502863883972,COMPLETE,weighted_ce,0.1,l2,256,0.0013615522916746855,2,1,84,2.0,2.1953059442252608e-05,hetgb_actor,0.7183257937431335,accuracy,"{'learning_rate': 0.0013615522916746855, 'weight_decay': 2.1953059442252608e-05, 'dropout': 0.1, 'hidden_dim': 256, 'num_charts': 1, 'membership_topk': 1, 'transportability_beta': 2.0, 'classification_loss': 'weighted_ce', 'feature_normalization': 'l2', 'seed': 84}",outputs\oracle_upper_bound\runs\hetgb_actor\trial_0017,stratified_60_20_20,0.7409502863883972,0.7734994292259216
18,0.48924121260643005,PRUNED,cross_entropy,0.1,none,256,0.002664862164245876,1,1,213,2.0,2.0269105317455095e-06,,0.48868781328201294,,,,,,
19,0.48924121260643005,PRUNED,cross_entropy,0.2,layernorm,128,0.0018834635589242785,2,1,221,0.0,3.715959557987794e-05,,0.48868781328201294,,,,,,
20,0.10645526647567749,PRUNED,weighted_ce,0.1,l2,256,0.0009612450726666097,2,1,116,0.5,5.5230515981326396e-05,,0.08257918804883957,,,,,,
21,0.7511312365531921,COMPLETE,weighted_ce,0.1,layernorm,128,0.0007474549955414613,1,1,206,0.0,5.7630905715128926e-06,hetgb_actor,0.7047511339187622,accuracy,"{'learning_rate': 0.0007474549955414613, 'weight_decay': 5.7630905715128926e-06, 'dropout': 0.1, 'hidden_dim': 128, 'num_charts': 1, 'membership_topk': 1, 'transportability_beta': 0.0, 'classification_loss': 'weighted_ce', 'feature_normalization': 'layernorm', 'seed': 206}",outputs\oracle_upper_bound\runs\hetgb_actor\trial_0021,stratified_60_20_20,0.7511312365531921,0.7610418796539307
22,0.7714932560920715,COMPLETE,weighted_ce,0.1,layernorm,128,0.0007780317301209109,1,1,215,0.0,2.7394989076222077e-05,hetgb_actor,0.6957013607025146,accuracy,"{'learning_rate': 0.0007780317301209109, 'weight_decay': 2.7394989076222077e-05, 'dropout': 0.1, 'hidden_dim': 128, 'num_charts': 1, 'membership_topk': 1, 'transportability_beta': 0.0, 'classification_loss': 'weighted_ce', 'feature_normalization': 'layernorm', 'seed': 215}",outputs\oracle_upper_bound\runs\hetgb_actor\trial_0022,stratified_60_20_20,0.7714932560920715,0.7667043805122375
23,0.7417893409729004,PRUNED,weighted_ce,0.1,layernorm,64,0.0017086537062162965,1,3,125,0.0,8.189731474707286e-06,,0.7183257937431335,,,,,,
24,0.6425339579582214,COMPLETE,weighted_ce,0.1,layernorm,256,0.0007853024411369919,1,1,471,0.0,6.74209137734801e-06,hetgb_actor,0.6210407614707947,accuracy,"{'learning_rate': 0.0007853024411369919, 'weight_decay': 6.74209137734801e-06, 'dropout': 0.1, 'hidden_dim': 256, 'num_charts': 1, 'membership_topk': 1, 'transportability_beta': 0.0, 'classification_loss': 'weighted_ce', 'feature_normalization': 'layernorm', 'seed': 471}",outputs\oracle_upper_bound\runs\hetgb_actor\trial_0024,stratified_60_20_20,0.6425339579582214,0.6579841375350952
25,0.5893665552139282,COMPLETE,weighted_ce,0.2,l2,256,0.0005520210794847397,1,1,184,2.0,3.5351090770034504e-06,hetgb_actor,0.32013577222824097,accuracy,"{'learning_rate': 0.0005520210794847397, 'weight_decay': 3.5351090770034504e-06, 'dropout': 0.2, 'hidden_dim': 256, 'num_charts': 1, 'membership_topk': 1, 'transportability_beta': 2.0, 'classification_loss': 'weighted_ce', 'feature_normalization': 'l2', 'seed': 184}",outputs\oracle_upper_bound\runs\hetgb_actor\trial_0025,stratified_60_20_20,0.5893665552139282,0.5911664366722107
26,0.1075877696275711,PRUNED,weighted_ce,0.0,l2,256,0.002984204714796149,2,4,0,2.0,7.726456697227128e-06,,0.11085973680019379,,,,,,
27,0.2072480171918869,PRUNED,weighted_ce,0.2,none,64,0.002560478763644359,2,1,44,2.0,4.033086085601972e-05,,0.2070135772228241,,,,,,
28,0.2072480171918869,PRUNED,weighted_ce,0.0,none,128,0.0005420451440306003,1,1,164,0.0,8.263711941575165e-06,,0.2070135772228241,,,,,,
29,0.35220837593078613,PRUNED,weighted_ce,0.1,layernorm,128,0.0011891401228984707,1,1,264,0.5,7.270709634716629e-06,,0.31900453567504883,,,,,,
30,0.14156284928321838,PRUNED,focal,0.1,l2,256,0.0011265385089423666,2,1,333,2.0,7.349889996573939e-06,,0.14253394305706024,,,,,,
31,0.06908266991376877,PRUNED,weighted_ce,0.1,l2,128,0.0004581994451056136,2,2,97,2.0,8.732600310295014e-06,,0.07013574987649918,,,,,,
32,0.5972850918769836,COMPLETE,weighted_ce,0.6,layernorm,128,0.0003291182422171648,1,1,201,0.0,0.0009188141802207497,hetgb_actor,0.3156108856201172,accuracy,"{'learning_rate': 0.0003291182422171648, 'weight_decay': 0.0009188141802207497, 'dropout': 0.6, 'hidden_dim': 128, 'num_charts': 1, 'membership_topk': 1, 'transportability_beta': 0.0, 'classification_loss': 'weighted_ce', 'feature_normalization': 'layernorm', 'seed': 201}",outputs\oracle_upper_bound\runs\hetgb_actor\trial_0032,stratified_60_20_20,0.5972850918769836,0.6081539988517761
33,0.48868781328201294,COMPLETE,focal,0.1,layernorm,128,0.0008964814504441237,2,1,23,0.0,3.6819632958844484e-05,hetgb_actor,0.1742081493139267,accuracy,"{'learning_rate': 0.0008964814504441237, 'weight_decay': 3.6819632958844484e-05, 'dropout': 0.1, 'hidden_dim': 128, 'num_charts': 1, 'membership_topk': 1, 'transportability_beta': 0.0, 'classification_loss': 'focal', 'feature_normalization': 'layernorm', 'seed': 23}",outputs\oracle_upper_bound\runs\hetgb_actor\trial_0033,stratified_60_20_20,0.48868781328201294,0.48924121260643005
34,0.5617213845252991,PRUNED,weighted_ce,0.1,layernorm,128,0.0003817820771625693,1,4,163,0.0,7.370449190648949e-06,,0.5678732991218567,,,,,,
35,0.06908266991376877,PRUNED,weighted_ce,0.1,l2,256,0.004915811192017527,2,1,31,2.0,2.0119352747531497e-05,,0.07013574987649918,,,,,,
36,0.4920814633369446,COMPLETE,weighted_ce,0.6,layernorm,128,0.001426422381536326,2,1,87,2.0,7.856336646605474e-05,hetgb_actor,0.49095025658607483,accuracy,"{'learning_rate': 0.001426422381536326, 'weight_decay': 7.856336646605474e-05, 'dropout': 0.6, 'hidden_dim': 128, 'num_charts': 1, 'membership_topk': 1, 'transportability_beta': 2.0, 'classification_loss': 'weighted_ce', 'feature_normalization': 'layernorm', 'seed': 87}",outputs\oracle_upper_bound\runs\hetgb_actor\trial_0036,stratified_60_20_20,0.4920814633369446,0.5062287449836731
37,0.48924121260643005,PRUNED,cross_entropy,0.1,none,128,0.0006330002900518454,1,3,355,0.25,1.1577419196381305e-05,,0.48868781328201294,,,,,,
38,0.3076923191547394,COMPLETE,focal,0.6,layernorm,128,0.0006214341385365331,1,1,350,0.0,6.388314759799841e-06,hetgb_actor,0.11764706671237946,accuracy,"{'learning_rate': 0.0006214341385365331, 'weight_decay': 6.388314759799841e-06, 'dropout': 0.6, 'hidden_dim': 128, 'num_charts': 1, 'membership_topk': 1, 'transportability_beta': 0.0, 'classification_loss': 'focal', 'feature_normalization': 'layernorm', 'seed': 350}",outputs\oracle_upper_bound\runs\hetgb_actor\trial_0038,stratified_60_20_20,0.3076923191547394,0.32616081833839417
39,0.48924121260643005,PRUNED,cross_entropy,0.1,layernorm,128,0.0006229062902086461,1,1,236,0.0,0.00010961854309884628,,0.48868781328201294,,,,,,
